web-scraper-order,web-scraper-start-url,handle,name,content,replies,retweets,favorites,unix_timestamp,published_date,url
"1565019059-52","https://twitter.com/search?l=pt&q=fnac%20since%3A2019-01-01%20until%3A2019-08-05&src=typd","@JorgeNu58478442","Pro FIFA Masters OFICIAL PORTUGAL","ALERTA #FIFA20 !
Nas lojas online, Worten, Fnac e GamingReplay aparece a capa do jogo MAS NAO MOSTRA o logo da Liga NOS!

Será que houve algum problema com a licença da liga portuguesa???","1","1","12","1564822762000","1:59 AM - 3 Aug 2019","/JorgeNu58478442/status/1157576683169492992"
"1565019059-315","https://twitter.com/search?l=pt&q=fnac%20since%3A2019-01-01%20until%3A2019-08-05&src=typd","@Danyelmesquita","🙃","Não encontro o documentário dos Amon Amarth em lado nenhum online. . . Ou encomendo ou espero que a fnac tenha à venda . . .","","","","1546378836000","1:40 PM - 1 Jan 2019","/Danyelmesquita/status/1080217249972133890"
"1565019059-83","https://twitter.com/search?l=pt&q=fnac%20since%3A2019-01-01%20until%3A2019-08-05&src=typd","@franciscaduque0","Jane Doe","Como é o aniversário do Harry, a Fnac está em promoção ""leve 3, pague 2""
Olhem só, I'm weak pic.twitter.com/c9vzVHGmt6","","","1","1564587359000","8:35 AM - 31 Jul 2019","/franciscaduque0/status/1156589332469358592"
"1565019059-194","https://twitter.com/search?l=pt&q=fnac%20since%3A2019-01-01%20until%3A2019-08-05&src=typd","@jfclopes","J. Lopes","Vi a foto desta miúda num telemóvel na fnac, por favor partilhem até chegar a ela  pic.twitter.com/Vgps3fUqHI","7","986","807","1559667430000","9:57 AM - 4 Jun 2019","/jfclopes/status/1135953653863464960"
"1565019059-301","https://twitter.com/search?l=pt&q=fnac%20since%3A2019-01-01%20until%3A2019-08-05&src=typd","@mptafonso","Afonso Gomes","Alguém vai gastar dinheiro na fnac? Preciso de trocar um cartão prenda","","","1","1546452775000","10:12 AM - 2 Jan 2019","/mptafonso/status/1080527373362257921"
"1565019059-156","https://twitter.com/search?l=pt&q=fnac%20since%3A2019-01-01%20until%3A2019-08-05&src=typd","@FCPorto","FC Porto","Final Copa Ibérica: bilhetes disponíveis amanhã (6€)
FC Porto- Portimonense ou Getafe
A partir das 10h:
Estádio Portimonense
Lojas Fnac, Worten e El Corte Inglés
http://ligaportugal.pt 
http://blueticket.pt/Tags/copaiberica …
A partir das 15h
Casas #FCPorto Quarteira e Olhãopic.twitter.com/C6vsDwzeGb","","18","291","1563575462000","3:31 PM - 19 Jul 2019","/FCPorto/status/1152345128763363329"
"1565019059-299","https://twitter.com/search?l=pt&q=fnac%20since%3A2019-01-01%20until%3A2019-08-05&src=typd","@claucoimbraa","Cláudia Coimbra","Omg Eu preciso deste tapete!!!! Ofereçam-me!!! É da fnac!!!! pic.twitter.com/ojUq1J7gQO","1","2","29","1546456747000","11:19 AM - 2 Jan 2019","/claucoimbraa/status/1080544031409618945"
"1565019059-317","https://twitter.com/search?l=pt&q=fnac%20since%3A2019-01-01%20until%3A2019-08-05&src=typd","@beamurteira","Bean  🥰","Eu só sei que a Fnac nunca mais abre em Aveiro e isto só mostra que 2019 já começou mal","1","","3","1546368857000","10:54 AM - 1 Jan 2019","/beamurteira/status/1080175396094705665"
"1565019059-100","https://twitter.com/search?l=pt&q=fnac%20since%3A2019-01-01%20until%3A2019-08-05&src=typd","@depressaoabras","👽 io","Espanha fez me perceber o quão merda a fnac de Portugal é","1","","5","1564501505000","8:45 AM - 30 Jul 2019","/depressaoabras/status/1156229234639216642"
"1565019059-68","https://twitter.com/search?l=pt&q=fnac%20since%3A2019-01-01%20until%3A2019-08-05&src=typd","@joaocerqueira30","Jøao Cerqueira","Finalmente Viana vai ter fnac! pic.twitter.com/49lB4aKGXw","","1","19","1564263470000","2:37 PM - 27 Jul 2019","/joaocerqueira30/status/1155230841792008193"
"1565019059-223","https://twitter.com/search?l=pt&q=fnac%20since%3A2019-01-01%20until%3A2019-08-05&src=typd","@noizyman","Pedro Noizyman","a família Pinault (Fnac Gucci Yves Sanit-Laurent) prometeu €100 milhões para a reconstrução da Notre Dame. os Arnault (Moët Hennessy Louis Vuitton) darão €200 milhões. alguém sabe de alguma grande empresa privada brasileira doando para a reconstrução do museu nacional?","4","26","83","1555419043000","5:50 AM - 16 Apr 2019","/noizyman/status/1118134627636477954"
"1565019059-278","https://twitter.com/search?l=pt&q=fnac%20since%3A2019-01-01%20until%3A2019-08-05&src=typd","@itsmishlawi","mishlawi","fnac do colombo domingo 10 FEV às 17H apareçam pic.twitter.com/R982ybgGzE","15","133","1.0K","1549395560000","11:39 AM - 5 Feb 2019","/itsmishlawi/status/1092870308325978114"
"1565019059-66","https://twitter.com/search?l=pt&q=fnac%20since%3A2019-01-01%20until%3A2019-08-05&src=typd","@dougdoalsi","doug doalsi","A Prado Monteiro tá com a mesma situação de muitas editoras reais, vide Saraiva, Cultura, FNAC... #BomSucesso","","2","3","1564701460000","4:17 PM - 1 Aug 2019","/dougdoalsi/status/1157067903386226688"
"1565019059-131","https://twitter.com/search?l=pt&q=fnac%20since%3A2019-01-01%20until%3A2019-08-05&src=typd","@NotTheSameBand","NOT.THE.SAME","AMADORA | 12 OUTUBRO |18H00

Lançamento do CD ""For You"" em Fnac Portugal https://www.instagram.com/p/B0keq2fnN2r/?igshid=10j145tn59taz …","","","2","1564552167000","10:49 PM - 30 Jul 2019","/NotTheSameBand/status/1156441723192664064"
"1565019059-117","https://twitter.com/search?l=pt&q=fnac%20since%3A2019-01-01%20until%3A2019-08-05&src=typd","@Fernand21373849","Fernanda Lima","A Cura Através Da Terapia de Vidas Passadas - Coleção Auto-Estima - Brian L. Weiss - Compra Livros na http://Fnac.pt  #fnac https://www.fnac.pt/mp11178108/A-Cura-Atraves-Da-Terapia-de-Vidas-Passadas-Colecao-Auto-Estima …","","","","1564568580000","3:23 AM - 31 Jul 2019","/Fernand21373849/status/1156510564564262912"
"1565019059-309","https://twitter.com/search?l=pt&q=fnac%20since%3A2019-01-01%20until%3A2019-08-05&src=typd","@emokidd1999","magaglidz","moça da fnac: queres fazer seguro para o caso de ser preciso reembolsar o bilhete?
eu: não vai ser preciso 

eu agora:","2","","10","1546434462000","5:07 AM - 2 Jan 2019","/emokidd1999/status/1080450563949629441"
"1565019059-149","https://twitter.com/search?l=pt&q=fnac%20since%3A2019-01-01%20until%3A2019-08-05&src=typd","@fnacportugal","FNAC Portugal","Quem está ansioso para o #WeAreNotYourKind, o novo álbum dos @slipknot?
Reserva a edição especial aqui http://bit.ly/SlipknotWANYKFnac …pic.twitter.com/1zuzY6Ctov","","","4","1564478189000","2:16 AM - 30 Jul 2019","/fnacportugal/status/1156131438267383808"
"1565019059-199","https://twitter.com/search?l=pt&q=fnac%20since%3A2019-01-01%20until%3A2019-08-05&src=typd","@voluptama","voluptama ™","A CDU já  tinha tido o barão vermelho, o trafulha da FNAC que patrocinou o Benfica nos anos 90. Agora com o Vieira sobe o nível.","7","5","37","1558732046000","2:07 PM - 24 May 2019","/voluptama/status/1132030366326431744"
"1565019059-107","https://twitter.com/search?l=pt&q=fnac%20since%3A2019-01-01%20until%3A2019-08-05&src=typd","@Bramboryz","Alexandre E.","No dia em que a fnac se engana no preço de um jogo que é uns 60 euros e coloca-o 8 euros, é quando eu estou de folga... e não estou em lisboa.","","","4","1564769460000","11:11 AM - 2 Aug 2019","/Bramboryz/status/1157353118264377344"
"1565019059-99","https://twitter.com/search?l=pt&q=fnac%20since%3A2019-01-01%20until%3A2019-08-05&src=typd","@PedroBarbosa988","Nando","Só gostava que a fnac fosse o meu melhor amigo pic.twitter.com/jJb2BX3JiO","","","1","1564518178000","1:22 PM - 30 Jul 2019","/PedroBarbosa988/status/1156299166081060864"
"1565019059-60","https://twitter.com/search?l=pt&q=fnac%20since%3A2019-01-01%20until%3A2019-08-05&src=typd","@ritalovejoonie","𝓜𝓸𝓸𝓷𝓬𝓱𝓲𝓵𝓭  🌙","Porque eh q qnd outra armys iam ah fnac comprar albuns a @fnacportugal oferecia posters ofc e quando eu vou ninguém me dá nada? :')pic.twitter.com/XE4mqWq6xb","12","15","47","1564751258000","6:07 AM - 2 Aug 2019","/ritalovejoonie/status/1157276772507013120"
"1565019059-277","https://twitter.com/search?l=pt&q=fnac%20since%3A2019-01-01%20until%3A2019-08-05&src=typd","@nuelinha23","Noélia","Acabo de conseguir que a FNAC Portugal me envie livros à Galiza. Qualquer ocasião é boa para movermos os marcos","4","22","152","1549574875000","1:27 PM - 7 Feb 2019","/nuelinha23/status/1093622410258141185"
"1565019059-310","https://twitter.com/search?l=pt&q=fnac%20since%3A2019-01-01%20until%3A2019-08-05&src=typd","@personablink","`","É na fnac de Coimbra??","1","","1","1546432589000","4:36 AM - 2 Jan 2019","/personablink/status/1080442705552048128"
"1565019059-58","https://twitter.com/search?l=pt&q=fnac%20since%3A2019-01-01%20until%3A2019-08-05&src=typd","@fnacportugal","FNAC Portugal","Hoje #ZecaAfonso faria 90 anos. Obrigado pelas palavras pic.twitter.com/vFcYeIaxJW","","2","12","1564755368000","7:16 AM - 2 Aug 2019","/fnacportugal/status/1157294011817910272"
"1565019059-254","https://twitter.com/search?l=pt&q=fnac%20since%3A2019-01-01%20until%3A2019-08-05&src=typd","@ProfJam6","ProfJam  ⬜","#FFFFFF CD NAS LOJAS DIA 8 DE MARÇO (Esta 6ª Feira) btw eu vou tar na fnac do Vasco da Gama esta 6ª antes do evento da História do Hip-Hop a assinar CDs e bilhetes para as apresentações. Apareçam  pic.twitter.com/0lHR346HZ6","10","317","1.1K","1551720263000","9:24 AM - 4 Mar 2019","/ProfJam6/status/1102620818469806085"
"1565019059-81","https://twitter.com/search?l=pt&q=fnac%20since%3A2019-01-01%20until%3A2019-08-05&src=typd","@fnacportugal","FNAC Portugal","Alexander Ludwig, o ator da série @HistoryVikings e o Cato de The Hunger Games, estará na @Comic_Con_PT deste ano 
#comicconportugal #Vikingspic.twitter.com/mRPwCxUhbV","","2","5","1564655512000","3:31 AM - 1 Aug 2019","/fnacportugal/status/1156875186488119297"
"1565019059-67","https://twitter.com/search?l=pt&q=fnac%20since%3A2019-01-01%20until%3A2019-08-05&src=typd","@FNACTchave","hacker russo","Em 2017 eu ainda tinha meus poderes...pic.twitter.com/xSi1VNPgcQ","1","15","153","1564620119000","5:41 PM - 31 Jul 2019","/FNACTchave/status/1156726735129448448"
"1565019059-94","https://twitter.com/search?l=pt&q=fnac%20since%3A2019-01-01%20until%3A2019-08-05&src=typd","@mariaclvalente","maria","mano fnac passamdp mal cp caralho","1","","3","1564787443000","4:10 PM - 2 Aug 2019","/mariaclvalente/status/1157428543149805568"
"1565019059-115","https://twitter.com/search?l=pt&q=fnac%20since%3A2019-01-01%20until%3A2019-08-05&src=typd","@PikachuChan11","Pikachu Chan","Oi gato galáctico fiz uma Fnac pra vc vai lá ver","","","","1564619178000","5:26 PM - 31 Jul 2019","/PikachuChan11/status/1156722790571098112"
"1565019059-170","https://twitter.com/search?l=pt&q=fnac%20since%3A2019-01-01%20until%3A2019-08-05&src=typd","@fnacportugal","FNAC Portugal","Mais uma novidade especial para os fãs de BTS, já em pré-venda na FNAC; http://bit.ly/bts-boy 

#bts #BoyWithLuvpic.twitter.com/dpjob8sUJA","19","97","229","1561734475000","8:07 AM - 28 Jun 2019","/fnacportugal/status/1144623467276460034"
"1565019059-84","https://twitter.com/search?l=pt&q=fnac%20since%3A2019-01-01%20until%3A2019-08-05&src=typd","@fnacportugal","FNAC Portugal","Quando o melhor dia para casar calha à quarta 
#QuimBarreirospic.twitter.com/YHi7Rx0u46","1","1","13","1564568570000","3:22 AM - 31 Jul 2019","/fnacportugal/status/1156510525280403456"
"1565019059-140","https://twitter.com/search?l=pt&q=fnac%20since%3A2019-01-01%20until%3A2019-08-05&src=typd","@helljuuuuuu_","Juuuuu","E se tiveres usado o cartão fnac eles conseguem ver a compra","","","1","1564746016000","4:40 AM - 2 Aug 2019","/helljuuuuuu_/status/1157254787211112454"
"1565019059-232","https://twitter.com/search?l=pt&q=fnac%20since%3A2019-01-01%20until%3A2019-08-05&src=typd","@namwings","bᵢₐ II homies in the back","eu na fnac a tentar decidir se devo ou nao comprar o album 
@BTS_twthttps://twitter.com/sailorlou/status/1114370024775483393 …","3","45","97","1554906557000","7:29 AM - 10 Apr 2019","/namwings/status/1115985102901739520"
"1565019059-165","https://twitter.com/search?l=pt&q=fnac%20since%3A2019-01-01%20until%3A2019-08-05&src=typd","@AviacaoGovBr","Sec de Aviação Civil","O investimento de mais de R$ 5 milhões, foi viabilizado por meio de convênio do @MInfraestrutura com o @GovernoMS. O Fundo Nacional de Aviação Civil (FNAC) participa com 70% do recurso para a realização das obras. Confira mais sobre a entrega: https://bit.ly/2RUVCD1 pic.twitter.com/U3y9iyDLVa","1","12","83","1562183363000","12:49 PM - 3 Jul 2019","/AviacaoGovBr/status/1146506242258550784"
"1565019059-62","https://twitter.com/search?l=pt&q=fnac%20since%3A2019-01-01%20until%3A2019-08-05&src=typd","@fcksubaek","ᴍᴀʀ↝sᴄ  💫","fnac have a good taste
mas e q tal vender mais álbuns deles ??? https://twitter.com/fnacportugal/status/1157237591718191104 …","1","6","11","1564747102000","4:58 AM - 2 Aug 2019","/fcksubaek/status/1157259339436044289"
"1565019059-145","https://twitter.com/search?l=pt&q=fnac%20since%3A2019-01-01%20until%3A2019-08-05&src=typd","@FNACTchave","hacker russo","crl parando pra pensar aqui, meu ensino médio foi uma putaria alucinada da poha","","","11","1564621609000","6:06 PM - 31 Jul 2019","/FNACTchave/status/1156732986873786369"
"1565019059-316","https://twitter.com/search?l=pt&q=fnac%20since%3A2019-01-01%20until%3A2019-08-05&src=typd","@dqueridolopes","Diogo","Mano já nenhuma gaja cai nesse paleio de merda.. em vez de estares à espera que ela saia da Zara estás à vontade para ir à fnac experimentar o fortnite https://twitter.com/oteureicrlh/status/1079543147213082625 …","","","1","1546370756000","11:25 AM - 1 Jan 2019","/dqueridolopes/status/1080183359228309504"
"1565019059-221","https://twitter.com/search?l=pt&q=fnac%20since%3A2019-01-01%20until%3A2019-08-05&src=typd","@AnaGuerraCFO","CLUB OFICIAL | Ana Guerra","FIRMA BARCELONA: FNAC https://twitter.com/Fnac_CAT/status/1118494965426995201 …","1","5","49","1555514396000","8:19 AM - 17 Apr 2019","/AnaGuerraCFO/status/1118534563926630400"
"1565019059-113","https://twitter.com/search?l=pt&q=fnac%20since%3A2019-01-01%20until%3A2019-08-05&src=typd","@philleite","Phill Maravilha","Tarde de autógrafos do dvd Arcos da Lapa na FNAC Morumbi em 2014 pic.twitter.com/Hm2Yl1jncn","","","1","1564677820000","9:43 AM - 1 Aug 2019","/philleite/status/1156968750534537218"
"1565019059-188","https://twitter.com/search?l=pt&q=fnac%20since%3A2019-01-01%20until%3A2019-08-05&src=typd","@EilishPT","Billie Eilish Portugal","// Informações Importantes para o Concerto \\
1º Venda geral dia 13 às 10H nos locais habituais (site da ticketline e lojas como FNAC e Worten);
2º Pré venda amanhã
3º Os bilhetes comprados anteriormente continuam válidos","1","7","32","1560161801000","3:16 AM - 10 Jun 2019","/EilishPT/status/1138027194746363904"
"1565019059-297","https://twitter.com/search?l=pt&q=fnac%20since%3A2019-01-01%20until%3A2019-08-05&src=typd","@yurdimple","beatriz - estudando","em portugal, na compra de um álbum de kpop na fnac, ganha um pôster do bts.

de quem era o álbum? pic.twitter.com/w1Zsn0iAJO","13","75","270","1546948925000","4:02 AM - 8 Jan 2019","/yurdimple/status/1082608377774125056"
"1565019059-193","https://twitter.com/search?l=pt&q=fnac%20since%3A2019-01-01%20until%3A2019-08-05&src=typd","@sofianotelhado","Sofia Carvalho","é triste entrar na fnac e a montra principal ser de livros que nos dizem como devemos ser felizes e viver a nossa vida - já ninguém se importa com a sua identidade?","1","6","52","1559753168000","9:46 AM - 5 Jun 2019","/sofianotelhado/status/1136313263069831168"
"1565019059-175","https://twitter.com/search?l=pt&q=fnac%20since%3A2019-01-01%20until%3A2019-08-05&src=typd","@PF_Fragoso","Pedro Fragoso","Mercado de transferências: acabei de ver Alexandre Pinto da Costa na secção dos livros da Fnac. Estou em condições de garantir que Francisco Geraldes está a caminho do Dragão, frustrando as intenções de Miguel Cardoso.","3","3","74","1561041886000","7:44 AM - 20 Jun 2019","/PF_Fragoso/status/1141718540896153601"
"1565019059-206","https://twitter.com/search?l=pt&q=fnac%20since%3A2019-01-01%20until%3A2019-08-05&src=typd","@fnacportugal","FNAC Portugal","Hey ARMY!
Vocês pediram e nós conseguimos! Já viram o que chegou à FNAC?
Descobre todas as figuras Funko Pop! dos BTS aqui: http://bit.ly/funkobts-fnac pic.twitter.com/PnFm0Mqvlu","57","227","518","1557478546000","1:55 AM - 10 May 2019","/fnacportugal/status/1126772806413242374"
"1565019059-103","https://twitter.com/search?l=pt&q=fnac%20since%3A2019-01-01%20until%3A2019-08-05&src=typd","@fcksubaek","ᴍᴀʀ↝sᴄ  💫","Bem-vindos à aula da @bye_ssseulgi
 
Lição n° 1: pedir mais álbuns á fnac é ser egocêntrica

Liçao n° 2: Aveiro é ""terrinha"" 

Espero que tenham gostado  https://twitter.com/bye_ssseulgi/status/1157370923881836544 …","1","","1","1564774020000","12:27 PM - 2 Aug 2019","/fcksubaek/status/1157372245796380673"
"1565019059-122","https://twitter.com/search?l=pt&q=fnac%20since%3A2019-01-01%20until%3A2019-08-05&src=typd","@sehobaek","xion's cute lips","Espero que na Fnac que vão abrir em Aveiro tenha bastantes álbuns deles! E das Red Velvet também :)","","","7","1564755700000","7:21 AM - 2 Aug 2019","/sehobaek/status/1157295405190864896"
"1565019059-127","https://twitter.com/search?l=pt&q=fnac%20since%3A2019-01-01%20until%3A2019-08-05&src=typd","@larissaissa","Larissa Moreno","Que saudade da falecida FNAC","2","","5","1564665817000","6:23 AM - 1 Aug 2019","/larissaissa/status/1156918408874795008"
"1565019059-306","https://twitter.com/search?l=pt&q=fnac%20since%3A2019-01-01%20until%3A2019-08-05&src=typd","@CCArade","Centro Congressos do Arade","""Faz-te Homem"" | 9 de Fevereiro | 21H30 
@CCArade 
Já tem o seu bilhete? // Bilhetes disponíveis na bilheteira do @CCArade, lojas Fnac e Worten e em https://bit.ly/2F1DbYU pic.twitter.com/ItFKEWORRL","","","","1546440575000","6:49 AM - 2 Jan 2019","/CCArade/status/1080476203906224128"
"1565019059-300","https://twitter.com/search?l=pt&q=fnac%20since%3A2019-01-01%20until%3A2019-08-05&src=typd","@ZPedro99","Zé Pedro","@Bruno7Aguiar meu volta ao Porto para dar blast de Sepultura na FNAC ahahaha curte bastante de ti, és um fixolas","","","1","1546454744000","10:45 AM - 2 Jan 2019","/ZPedro99/status/1080535630923345921"
"1565019059-240","https://twitter.com/search?l=pt&q=fnac%20since%3A2019-01-01%20until%3A2019-08-05&src=typd","@leonormf13","leonor","Ainda não acredito que isto vai acontecer mas ya... entre 7 e 12 de abril passem na fnac do Palácio  pic.twitter.com/SG4tqimZuG","3","46","98","1554121570000","5:26 AM - 1 Apr 2019","/leonormf13/status/1112692631207923713"
"1565019059-110","https://twitter.com/search?l=pt&q=fnac%20since%3A2019-01-01%20until%3A2019-08-05&src=typd","@momentolinear","a sonsa bonitinha","quando é que a fnac abre em aveiro? por favor coloquem álbuns dos exo e das red velvet à venda <3","1","","5","1564754641000","7:04 AM - 2 Aug 2019","/momentolinear/status/1157290962068082688"
"1565019059-57","https://twitter.com/search?l=pt&q=fnac%20since%3A2019-01-01%20until%3A2019-08-05&src=typd","@fcksubaek","ᴍᴀʀ↝sᴄ  💫","dps disto nunca mais vou dizer nada à fnac 
 pic.twitter.com/fX2VTqgT8C","1","","1","1564769914000","11:18 AM - 2 Aug 2019","/fcksubaek/status/1157355022767837184"
"1565019059-126","https://twitter.com/search?l=pt&q=fnac%20since%3A2019-01-01%20until%3A2019-08-05&src=typd","@FNACTchave","hacker russo","kkjjjjjjjjjjjjjjjjjjjjjjjjjjjjjjjjjjjjjj vou comer uma tinta ali pra ver se fico feliz a da o cu pohahttps://twitter.com/sadneigh/status/1156729637231370242 …","1","1","5","1564688130000","12:35 PM - 1 Aug 2019","/FNACTchave/status/1157011996602245121"
"1565019059-129","https://twitter.com/search?l=pt&q=fnac%20since%3A2019-01-01%20until%3A2019-08-05&src=typd","@Fnac","Fnac","Bravo à Nicolas Morvan pic.twitter.com/9KwxsgaeoL","1","","4","1564655023000","3:23 AM - 1 Aug 2019","/Fnac/status/1156873134626299906"
"1565019059-231","https://twitter.com/search?l=pt&q=fnac%20since%3A2019-01-01%20until%3A2019-08-05&src=typd","@ptarmysnation","PT ARMYS NATION","MOTS ALBÚM
As pré-encomendas do album já ultrapassaram os 3M a nivel mundial.

Neste momento o albúm (em pré-venda) também se encontra esgotado na fnac de Portugal","","24","56","1555023126000","3:52 PM - 11 Apr 2019","/ptarmysnation/status/1116474031551721472"
"1565019059-138","https://twitter.com/search?l=pt&q=fnac%20since%3A2019-01-01%20until%3A2019-08-05&src=typd","@fnacportugal","FNAC Portugal","Ainda não conseguimos ter todos, mas já temos alguns  Dá uma vista de olhos no nosso site: https://www.fnac.pt/ia416912/Exo?SCat=3!1%2c3005!2&SFilt=1!206&sl …","1","2","12","1564749246000","5:34 AM - 2 Aug 2019","/fnacportugal/status/1157268333969969152"
"1565019059-143","https://twitter.com/search?l=pt&q=fnac%20since%3A2019-01-01%20until%3A2019-08-05&src=typd","@margaridaarcl","guida","Como é da fnac é capaz de não haver problema","1","","1","1564698796000","3:33 PM - 1 Aug 2019","/margaridaarcl/status/1157056732620738560"
"1565019059-198","https://twitter.com/search?l=pt&q=fnac%20since%3A2019-01-01%20until%3A2019-08-05&src=typd","@softmi_uwu","Riτα ᶦˢ ˢᵒᶠᵗ ♡","Os @BTS_twt podem até n vir este ano a Portugal mas este pode ser o nosso ano porque tipo:

1.Os álbuns deles estão sempre ou quase sempre nos tops de vendas da fnac
2. Conseguimos pôr a música deles a tocar regularmente em quase tds as rádios e na mtv 
+","3","10","24","1558860779000","1:52 AM - 26 May 2019","/softmi_uwu/status/1132570311981969409"
"1565019059-294","https://twitter.com/search?l=pt&q=fnac%20since%3A2019-01-01%20until%3A2019-08-05&src=typd","@jonisborn","Jon Born","Fun fact;
Um bloco de apontamentos que no Continente custa 3,5 euros, na Fnac chama-se “moleskine” e custa 16 euros.","3","14","89","1547632446000","1:54 AM - 16 Jan 2019","/jonisborn/status/1085475270356799489"
"1565019059-53","https://twitter.com/search?l=pt&q=fnac%20since%3A2019-01-01%20until%3A2019-08-05&src=typd","@manliketiago","tiαgσ","quandk fazes o trabalho de deus na fnac pic.twitter.com/UxtPkc2SVZ","","","3","1564778978000","1:49 PM - 2 Aug 2019","/manliketiago/status/1157393038416764930"
"1565019059-133","https://twitter.com/search?l=pt&q=fnac%20since%3A2019-01-01%20until%3A2019-08-05&src=typd","@oh_honneyy","Leonor ;-)","apanhei a minha irmã a cantar senhora da fnac e acho que a minha missão nesta terra está completa","1","1","10","1564315643000","5:07 AM - 28 Jul 2019","/oh_honneyy/status/1155449671944245249"
"1565019059-218","https://twitter.com/search?l=pt&q=fnac%20since%3A2019-01-01%20until%3A2019-08-05&src=typd","@MInfraestrutura","Ministério da Infraestrutura","Secretaria de @Aviacaogovbr e @infraero entregam obras de reforma e ampliação do aeroporto de Marabá (PA). Os investimentos, da ordem de R$11,4 milhões, foram provenientes do Fundo Nacional de Aviação Civil (Fnac). Confira: https://bit.ly/2KZjd5B pic.twitter.com/DKrXXyedIG","1","9","81","1556049517000","12:58 PM - 23 Apr 2019","/MInfraestrutura/status/1120779025662783491"
"1565019059-183","https://twitter.com/search?l=pt&q=fnac%20since%3A2019-01-01%20until%3A2019-08-05&src=typd","@FanbasesPt","União Fanbases PT  🇵🇹","Nós somos muito mimados pela fnac, para além do álbum da OST do BTS World temos também disponível o álbum japonês.

Obrigada @fnacportugal pic.twitter.com/RkB6c6fKqn","3","16","48","1560338897000","4:28 AM - 12 Jun 2019","/FanbasesPt/status/1138769989874438144"
"1565019059-54","https://twitter.com/search?l=pt&q=fnac%20since%3A2019-01-01%20until%3A2019-08-05&src=typd","@Carlos_Borges98","carlos_borges","MEGA PROMOÇÃO NA FNAC!!! 
Pra mais informações viste o site http://www.vamosSerRoubadosPelaAFnac.com pic.twitter.com/0BCGRdS2eO","1","2","9","1564778952000","1:49 PM - 2 Aug 2019","/Carlos_Borges98/status/1157392931784929282"
"1565019059-161","https://twitter.com/search?l=pt&q=fnac%20since%3A2019-01-01%20until%3A2019-08-05&src=typd","@FCPorto","FC Porto","Info Bilhetes

FC Porto-Fulham: 15€
Loja Associado e Casa FC Porto Quarteira

#FCPorto-Bétis: 6€
Loja Associado e Casa FC Porto Quarteira
Estádio Portimonense
Lojas Fnac, Worten e El Corte Inglés
http://ligaportugal.pt 
http://blueticket.pt/Tags/copaiberica …

#PreSeasonpic.twitter.com/jReiCMQl5A","4","36","313","1562928821000","3:53 AM - 12 Jul 2019","/FCPorto/status/1149632918106460160"
"1565019059-72","https://twitter.com/search?l=pt&q=fnac%20since%3A2019-01-01%20until%3A2019-08-05&src=typd","@MENSMAGS","MEN’S MAG","A Fnac gigante de Aveiro abre já na próxima semana https://nit.pt/coolt/livros/fnac-gigante-aveiro-abre-ja-na-proxima-semana?utm_source=dlvr.it&utm_medium=twitter …pic.twitter.com/IpOAzlyu1K","","","","1564841858000","7:17 AM - 3 Aug 2019","/MENSMAGS/status/1157656778210811904"
"1565019059-222","https://twitter.com/search?l=pt&q=fnac%20since%3A2019-01-01%20until%3A2019-08-05&src=typd","@CFosBelenenses","Os Belenenses","O #Belenenses espera por ti na Praça FNAC do Almada Fórum até 21 de Abril, das 10h00 às 24h00, onde está patente mais uma edição do circuito da exposição que recorda os  anos do emblema da #CruzDeCristo. Vem celebrar o #CentenárioCFB!  #tweetpastelpic.twitter.com/6x5GoGLVRo","","3","22","1555497000000","3:30 AM - 17 Apr 2019","/CFosBelenenses/status/1118461601491902465"
"1565019059-217","https://twitter.com/search?l=pt&q=fnac%20since%3A2019-01-01%20until%3A2019-08-05&src=typd","@passapalavra","Passa Palavra","Ano passado já noticiamos a luta de alguns trabalhadores do mercado livreiro na Fnac /  livraria Cultura.
Trabalhadores do livro protestam na Livraria Cultura por pagamento | Passa Palavra https://passapalavra.info/2018/10/123205/","","9","33","1556139370000","1:56 PM - 24 Apr 2019","/passapalavra/status/1121155896422424577"
